{
 "school_id": "sample-dwarka",
 "lat": 28.59,
 "lon": 77.05,
 "generated_at": "2026-10-12T01:30:00Z",
 "source": "sample",
 "now": {
  "time": "2026-10-12T01:00:00Z",
  "pm25": 112.0,
  "pm25_24h_mean": 105.3,
  "aqi": 251,
  "aqi_basis": "CPCB PM2.5 sub-index of the CAMS model's trailing 24-h mean (indicative, not an official CPCB AQI)",
  "band": "amber"
 },
 "hours": [
  {
   "time": "2026-10-12T01:00:00Z",
   "pm25": 116.0,
   "band": "amber"
  },
  {
   "time": "2026-10-12T02:00:00Z",
   "pm25": 106.0,
   "band": "amber"
  },
  {
   "time": "2026-10-12T03:00:00Z",
   "pm25": 90.0,
   "band": "amber"
  },
  {
   "time": "2026-10-12T04:00:00Z",
   "pm25": 69.0,
   "band": "amber"
  },
  {
   "time": "2026-10-12T05:00:00Z",
   "pm25": 54.0,
   "band": "green"
  },
  {
   "time": "2026-10-12T06:00:00Z",
   "pm25": 48.0,
   "band": "green"
  },
  {
   "time": "2026-10-12T07:00:00Z",
   "pm25": 47.0,
   "band": "green"
  },
  {
   "time": "2026-10-12T08:00:00Z",
   "pm25": 81.5,
   "band": "amber"
  },
  {
   "time": "2026-10-12T09:00:00Z",
   "pm25": 88.5,
   "band": "amber"
  },
  {
   "time": "2026-10-12T10:00:00Z",
   "pm25": 96.0,
   "band": "amber"
  },
  {
   "time": "2026-10-12T11:00:00Z",
   "pm25": 105.0,
   "band": "amber"
  },
  {
   "time": "2026-10-12T12:00:00Z",
   "pm25": 87.5,
   "band": "amber"
  },
  {
   "time": "2026-10-12T13:00:00Z",
   "pm25": 102.5,
   "band": "amber"
  },
  {
   "time": "2026-10-12T14:00:00Z",
   "pm25": 117.5,
   "band": "amber"
  },
  {
   "time": "2026-10-12T15:00:00Z",
   "pm25": 130.0,
   "band": "red"
  },
  {
   "time": "2026-10-12T16:00:00Z",
   "pm25": 137.5,
   "band": "red"
  },
  {
   "time": "2026-10-12T17:00:00Z",
   "pm25": 141.0,
   "band": "red"
  },
  {
   "time": "2026-10-12T18:00:00Z",
   "pm25": 140.0,
   "band": "red"
  },
  {
   "time": "2026-10-12T19:00:00Z",
   "pm25": 136.5,
   "band": "red"
  },
  {
   "time": "2026-10-12T20:00:00Z",
   "pm25": 133.5,
   "band": "red"
  },
  {
   "time": "2026-10-12T21:00:00Z",
   "pm25": 130.0,
   "band": "red"
  },
  {
   "time": "2026-10-12T22:00:00Z",
   "pm25": 126.0,
   "band": "red"
  },
  {
   "time": "2026-10-12T23:00:00Z",
   "pm25": 123.0,
   "band": "red"
  },
  {
   "time": "2026-10-13T00:00:00Z",
   "pm25": 121.0,
   "band": "red"
  }
 ]
}
